CMS Certification Number (CCN),Provider Name,City/Town,County/Parish,State,health_inspection_rating,short_stay_qm_rating,adjusted_total_nurse_hours_per_resident_day,estimated_occupancy_rate,abuse_icon_flag,total_weighted_health_survey_score,rating_cycle_1_total_health_score
315497,ALLENDALE REHABILITATION AND HEALTHCARE CENTER,ALLENDALE,Bergen,NJ,3.0,4.0,3.25771,0.8291666666666667,0,56.0,64.0
315313,CAREONE AT CRESSKILL,CRESSKILL,Bergen,NJ,4.0,5.0,3.15164,0.7371681415929203,0,31.0,36.0
315360,Emerson Health Care Center,EMERSON,Bergen,NJ,5.0,4.0,4.33627,0.8767741935483871,0,2.0,0.0
315377,"ACTORS FUND HOME, THE",ENGLEWOOD,Bergen,NJ,4.0,2.0,5.01175,0.8728971962616823,0,35.0,44.0
315349,"COMPLETE CARE AT INGLEMOOR, LLC",ENGLEWOOD,Bergen,NJ,2.0,2.0,3.35536,0.9338709677419355,0,94.0,100.0
315328,MAPLE GLEN CENTER,FAIRLAWN,Bergen,NJ,3.0,4.0,3.32961,0.7572327044025158,0,46.0,60.0
315152,CAREONE AT WELLINGTON,HACKENSACK,Bergen,NJ,2.0,5.0,3.37655,0.82890625,0,86.0,100.0
315460,COMPLETE CARE AT PROSPECT HEIGHTS LLC,HACKENSACK,Bergen,NJ,1.0,5.0,2.81068,0.6127551020408163,0,112.0,120.0
315295,COMPLETE CARE AT REGENT LLC,HACKENSACK,Bergen,NJ,2.0,3.0,3.36611,0.9433333333333334,0,89.0,108.0
315386,ATLAS REHABILITATION AND HEALTHCARE AT MAYWOOD,MAYWOOD,Bergen,NJ,3.0,5.0,3.13147,0.925,0,58.0,76.0
315306,CAREONE AT NEW MILFORD,NEW MILFORD,Bergen,NJ,2.0,5.0,2.95345,0.7635593220338982,0,75.0,80.0
315290,"BUCKINGHAM AT NORWOOD, THE",NORWOOD,Bergen,NJ,1.0,2.0,3.0893,0.7020833333333333,0,282.0,345.0
315171,OAKLAND REHABILITATION AND HEALTHCARE  CENTER,OAKLAND,Bergen,NJ,1.0,5.0,3.84641,0.8753488372093022,0,318.0,380.0
315339,CAREONE AT ORADELL,ORADELL,Bergen,NJ,1.0,5.0,3.86224,0.7909090909090909,0,113.0,120.0
315017,BERGEN NEW BRIDGE MEDICAL CENTER,PARAMUS,Bergen,NJ,3.0,4.0,3.71396,0.6202090592334495,0,58.0,64.0
315426,CAREONE AT RIDGEWOOD AVENUE,PARAMUS,Bergen,NJ,2.0,5.0,2.93461,0.9181818181818182,0,89.25,111.0
315129,DELLRIDGE HEALTH & REHABILITATION CENTER,PARAMUS,Bergen,NJ,2.0,4.0,3.6617,1.0218749999999999,0,64.0,72.0
315346,NEW JERSEY VETERANS MEMORIAL HOME AT PARAMUS,PARAMUS,Bergen,NJ,5.0,,6.29681,0.5967261904761905,0,18.0,24.0
315438,Atrium Post Acute Care at Park Ridge,PARK RIDGE,Bergen,NJ,1.0,4.0,3.41256,0.8504761904761905,0,106.0,136.0
315434,Family of Caring Healthcare at Ridgewood,RIDGEWOOD,Bergen,NJ,4.0,3.0,3.48273,0.9010416666666666,0,28.0,24.0
315158,RIDGEWOOD CENTER,RIDGEWOOD,Bergen,NJ,1.0,4.0,3.33637,0.7433333333333334,0,175.5,222.0
315494,ALARIS HEALTH AT THE CHATEAU,ROCHELLE PARK,Bergen,NJ,4.0,4.0,3.5531,0.7796812749003984,0,22.0,16.0
315473,JEWISH HOME AT ROCKLEIGH,ROCKLEIGH,Bergen,NJ,3.0,3.0,4.72302,0.9556122448979593,0,54.0,72.0
315502,CareOne At Teaneck,TEANECK,Bergen,NJ,3.0,5.0,3.32497,0.625,0,43.0,52.0
315037,FAMILY OF CARING AT TEANECK LLC,TEANECK,Bergen,NJ,4.0,2.0,3.49121,0.9738317757009346,0,31.0,40.0
315164,"FAMILY OF CARING HEALTHCARE AT TENAFLY, LLC",TENAFLY,Bergen,NJ,3.0,4.0,3.57529,0.9289855072463767,0,42.0,48.0
315369,CAREONE AT VALLEY,WESTWOOD,Bergen,NJ,5.0,5.0,3.21719,0.8653061224489795,0,15.0,16.0
315133,WOODCLIFF LAKE HEALTH & REHABILITATION CENTER,WOODCLIFF LAKE,Bergen,NJ,4.0,5.0,3.15724,0.7508771929824561,0,17.0,16.0
315376,CHRISTIAN HEALTH CARE CENTER,WYCKOFF,Bergen,NJ,2.0,4.0,4.17758,0.9101973684210526,0,79.0,88.0
315392,Job Haines Home For Aged People,BLOOMFIELD,Essex,NJ,5.0,4.0,5.82877,0.9475,0,4.0,4.0
315471,ST CATHERINE OF SIENA,CALDWELL,Essex,NJ,3.0,,2.10046,0.8566666666666667,0,46.0,52.0
315357,ALARIS HEALTH AT CEDAR GROVE,CEDAR GROVE,Essex,NJ,1.0,5.0,5.5559,0.7034782608695652,0,116.75,96.0
315036,ARBOR GLEN CENTER,CEDAR GROVE,Essex,NJ,1.0,4.0,3.21652,0.8131147540983606,0,105.25,131.0
315204,CANTERBURY AT CEDAR GROVE,CEDAR GROVE,Essex,NJ,1.0,2.0,,,0,130.5,76.0
315216,COMPLETE CARE AT CEDAR GROVE,CEDAR GROVE,Essex,NJ,3.0,5.0,3.74909,0.9010526315789473,0,40.0,24.0
315194,COMPLETE CARE AT ST VINCENTS LLC,CEDAR GROVE,Essex,NJ,5.0,4.0,3.27503,0.905298013245033,0,4.0,0.0
315268,BROOKHAVEN HEALTH CARE CENTER,EAST ORANGE,Essex,NJ,3.0,3.0,3.33231,0.940983606557377,0,39.0,40.0
315178,COMPLETE CARE AT ORANGE PARK,EAST ORANGE,Essex,NJ,3.0,3.0,3.84214,0.9246511627906977,0,47.0,48.0
315147,GROVE PARK HEALTHCARE AND REHABILITATION CENTER,EAST ORANGE,Essex,NJ,2.0,5.0,3.83757,0.941081081081081,0,79.0,76.0
315266,Park Crescent Healthcare & Rehabilitation Center,EAST ORANGE,Essex,NJ,3.0,5.0,3.76125,0.8842105263157894,0,51.75,36.0
315359,ALLIANCE CARE REHABILITATION AND NURSING CENTER,IRVINGTON,Essex,NJ,2.0,3.0,2.94668,0.9108490566037736,0,63.0,32.0
315479,CAREONE AT LIVINGSTON,LIVINGSTON,Essex,NJ,4.0,5.0,3.92088,0.505,0,29.0,28.0
315322,INGLEMOOR REHABILITATION AND CARE CENTER,LIVINGSTON,Essex,NJ,5.0,5.0,4.2655,0.7456521739130435,0,1.0,0.0
315526,LIVINGSTON POST ACUTE CARE,LIVINGSTON,Essex,NJ,1.0,5.0,3.05877,1.0435483870967743,0,109.0,136.0
315527,WINCHESTER GARDENS HEALTH CARE CENTER,MAPLEWOOD,Essex,NJ,4.0,5.0,5.51691,0.8066666666666666,0,28.0,28.0
315435,Family of Caring Healthcare at Montclair,MONTCLAIR,Essex,NJ,4.0,4.0,3.47018,0.95,0,34.0,40.0
315363,MONTCLAIR CARE CENTER,MONTCLAIR,Essex,NJ,4.0,4.0,3.91172,0.7578125,0,24.0,12.0
315343,BROADWAY HOUSE FOR CONTINUING CARE,NEWARK,Essex,NJ,4.0,,,0.9141025641025641,0,25.0,24.0
315375,FOREST HILLS CENTER FOR REHABILITATION AND HEALING,NEWARK,Essex,NJ,1.0,3.0,3.63236,0.925,0,194.75,198.0
315393,NEW COMMUNITY EXTENDED CARE FACILITY,NEWARK,Essex,NJ,1.0,,2.81659,0.5127777777777778,0,274.25,359.0
315458,NEW VISTA NURSING & REHABILITATION CTR,NEWARK,Essex,NJ,1.0,3.0,4.99632,0.7305882352941176,0,110.0,84.0
315236,SINAI POST-ACUTE NURSING & REHAB CENTER,NEWARK,Essex,NJ,1.0,2.0,3.53887,0.9097674418604651,0,252.5,68.0
315352,Axia Care Center of Orange,ORANGE,Essex,NJ,1.0,3.0,4.12549,0.8643617021276596,0,244.25,315.0
315372,WHITE HOUSE HEALTHCARE AND REHABILITATION CENTER,ORANGE,Essex,NJ,4.0,5.0,3.78315,0.9340909090909091,0,36.0,44.0
315247,COMPLETE CARE AT WEST CALDWELL LLC,WEST CALDWELL,Essex,NJ,3.0,5.0,3.39091,0.7638888888888888,0,43.0,56.0
315457,LUTHERAN SOCIAL MINISTRIES CRANES MILL,WEST CALDWELL,Essex,NJ,4.0,5.0,4.30033,0.6678571428571428,0,19.0,16.0
315449,ALARIS HEALTH AT WEST ORANGE,WEST ORANGE,Essex,NJ,2.0,4.0,3.803,0.9125,0,61.0,40.0
315038,COMPLETE CARE AT SUMMIT RIDGE,WEST ORANGE,Essex,NJ,3.0,4.0,3.78374,0.9361842105263158,0,53.0,44.0
315029,DAUGHTERS OF ISRAEL PLEASANT VALLEY HOME,WEST ORANGE,Essex,NJ,3.0,5.0,4.18611,0.3165016501650165,0,60.0,64.0
315416,GREEN HILL,WEST ORANGE,Essex,NJ,2.0,4.0,3.59726,0.7464566929133858,0,84.0,100.0
315066,STRATFORD MANOR REHABILITATION AND CARE CENTER,WEST ORANGE,Essex,NJ,3.0,5.0,3.26966,0.950381679389313,0,40.0,28.0
315532,BAYONNE UNIVERSITY HOSPITAL,BAYONNE,Hudson,NJ,5.0,,6.47116,0.6470588235294118,0,15.0,20.0
315512,HOBOKEN UNIVERSITY MEDICAL CENTER TCU,HOBOKEN,Hudson,NJ,4.0,4.0,7.40962,0.6466666666666666,0,20.0,20.0
315083,ACCLAIM REHABILITATION AND NURSING CENTER,JERSEY CITY,Hudson,NJ,3.0,5.0,3.53391,0.846448087431694,0,49.0,60.0
315300,ALARIS HEALTH AT HAMILTON PARK,JERSEY CITY,Hudson,NJ,4.0,3.0,3.82496,0.6265384615384616,0,28.0,20.0
315310,OPTIMA CARE HARBORVIEW,JERSEY CITY,Hudson,NJ,4.0,4.0,2.84742,0.74,0,31.0,24.0
315413,PEACE CARE ST ANN'S,JERSEY CITY,Hudson,NJ,4.0,3.0,3.82368,0.9075000000000001,0,23.0,20.0
315452,PEACE CARE ST JOSEPH'S,JERSEY CITY,Hudson,NJ,3.0,5.0,4.29549,0.8964028776978417,0,49.0,44.0
315366,ALARIS HEALTH AT BELGROVE,KEARNY,Hudson,NJ,1.0,3.0,4.50064,0.7941666666666667,0,114.0,131.0
315192,ALARIS HEALTH AT KEARNY,KEARNY,Hudson,NJ,4.0,2.0,3.58995,0.8933333333333333,0,29.0,32.0
315307,COMPLETE CARE AT HARBORAGE LLC,NORTH BERGEN,Hudson,NJ,4.0,4.0,3.1003,0.9149797570850202,0,32.0,28.0
315525,HARBOUR VIEW SENIOR LIVING CORP,NORTH BERGEN,Hudson,NJ,2.0,2.0,5.74949,0.935,0,73.0,88.0
315112,HUDSONVIEW HEALTH CARE CENTER,NORTH BERGEN,Hudson,NJ,4.0,4.0,2.99797,0.9608058608058608,0,34.0,32.0
315476,OPTIMA CARE FOUNTAINS,SECAUCUS,Hudson,NJ,1.0,,5.08527,0.841616766467066,0,148.75,152.0
315465,MANHATTANVIEW CTR FOR REHABILITATION AND HEALTHCAR,UNION CITY,Hudson,NJ,3.0,2.0,3.05201,0.9661417322834646,0,60.0,68.0
315344,OPTIMA CARE CASTLE HILL,UNION CITY,Hudson,NJ,1.0,5.0,3.88859,0.6362790697674419,0,163.25,195.0
315467,LITTLE BROOK NURSING AND CONVALESCENT HOME,CALIFON,Hunterdon,NJ,1.0,,3.6085,0.75,0,697.5,524.0
315226,HUNTERDON CARE CENTER LLC,FLEMINGTON,Hunterdon,NJ,2.0,5.0,3.43144,0.9156756756756758,0,83.5,94.0
315302,ROLLING HILLS CARE CENTER,LEBANON,Hunterdon,NJ,1.0,5.0,3.56796,0.8925373134328358,0,188.25,223.0
315433,COUNTRY ARCH CARE CENTER,PITTSTOWN,Hunterdon,NJ,3.0,5.0,3.90913,0.8423076923076923,0,41.0,0.0
315451,THE ELMS REHAB AND HEALTHCARE CENTER OF CRANBURY,CRANBURY,Middlesex,NJ,3.0,5.0,3.45301,0.7391666666666666,0,39.25,8.0
315472,CAREONE AT EAST BRUNSWICK,EAST BRUNSWICK,Middlesex,NJ,3.0,5.0,3.30593,0.7583333333333333,0,51.0,64.0
315351,BRIGHTON GARDENS OF EDISON,EDISON,Middlesex,NJ,3.0,4.0,6.18005,0.84,0,53.75,32.0
315132,CareOne at The Highlands,EDISON,Middlesex,NJ,3.0,4.0,3.5151,0.8327868852459016,0,52.0,48.0
315279,EMBASSY MANOR AT EDISON NURSING AND REHABILITATION,EDISON,Middlesex,NJ,2.0,1.0,3.64493,0.7864285714285714,0,63.0,64.0
315251,HARTWYCK AT OAK TREE,EDISON,Middlesex,NJ,4.0,3.0,3.67682,0.7525,0,18.0,24.0
315459,NEW JERSEY VETERANS MEMORIAL HOME MENLO,EDISON,Middlesex,NJ,4.0,4.0,6.17867,0.5911585365853659,0,27.0,36.0
315039,ROOSEVELT CARE CENTER,EDISON,Middlesex,NJ,2.0,5.0,4.58603,0.8916666666666667,0,90.0,96.0
315362,COMPLETE CARE AT PARK PLACE LLC,MONMOUTH JUNCTION,Middlesex,NJ,3.0,5.0,2.97767,0.9446808510638297,0,53.75,8.0
315353,CRANBURY CENTER,MONROE TOWNSHIP,Middlesex,NJ,4.0,2.0,3.56063,0.6532467532467532,0,28.0,28.0
315336,"GARDENS AT MONROE HEALTHCARE AND REHABILITATION, T",MONROE TOWNSHIP,Middlesex,NJ,3.0,4.0,3.88833,0.7374999999999999,0,34.0,16.0
315269,VILLAGE POINT,MONROE TOWNSHIP,Middlesex,NJ,3.0,5.0,4.62578,0.8558333333333333,0,37.5,16.0
315384,ROSE MOUNTAIN CARE CENTER,NEW BRUNSWICK,Middlesex,NJ,1.0,5.0,4.33328,0.8312499999999999,0,177.5,198.0
315381,AUTUMN LAKE HEALTHCARE AT OLD BRIDGE,OLD BRIDGE,Middlesex,NJ,4.0,3.0,3.38121,0.9533333333333334,0,18.0,16.0
315321,"PREFERRED CARE AT OLD BRIDGE, LLC",OLD BRIDGE,Middlesex,NJ,4.0,5.0,3.60443,0.8814285714285715,0,28.0,24.0
315417,REFORMED CHURCH HOME,OLD BRIDGE,Middlesex,NJ,5.0,5.0,4.14357,0.8777777777777778,0,6.0,4.0
315509,Roosevelt Care Center At Old Bridge,OLD BRIDGE,Middlesex,NJ,5.0,5.0,4.48324,0.8683333333333334,0,17.0,20.0
315180,ALAMEDA CENTER FOR REHABILITATION AND HEALTHCARE,PERTH AMBOY,Middlesex,NJ,3.0,5.0,4.03504,0.894,0,57.0,48.0
315305,SPRING CREEK HEALTHCARE CENTER,PERTH AMBOY,Middlesex,NJ,4.0,2.0,3.06843,0.7731843575418995,0,34.0,32.0
315522,ACCELERATE SKILLED NURSING AND REHAB PISCATAWAY,PISCATAWAY,Middlesex,NJ,1.0,5.0,3.8466,0.8370967741935483,1,278.75,187.0
315001,"MERWICK CARE & REHAB CENTER, LLC",PLAINSBORO,Middlesex,NJ,1.0,4.0,3.39669,0.7120000000000001,0,149.0,56.0
315518,"VENETIAN CARE & REHABILITATION CENTER, THE",SOUTH AMBOY,Middlesex,NJ,2.0,3.0,3.34589,0.7611111111111111,0,98.0,108.0
315214,ARISTACARE AT CEDAR OAKS,SOUTH PLAINFIELD,Middlesex,NJ,2.0,5.0,3.39016,0.8656521739130435,1,93.25,99.0
315318,"ST JOSEPH'S HOME AL & NC, INC",WOODBRIDGE,Middlesex,NJ,5.0,,4.45237,0.9450980392156864,0,2.0,0.0
315397,PREFERRED CARE AT WALL,ALLENWOOD,Monmouth,NJ,4.0,5.0,3.48397,0.8874074074074074,0,31.0,40.0
315087,CAREONE AT MIDDLETOWN,ATLANTIC HIGHLANDS,Monmouth,NJ,2.0,3.0,3.7122,0.6590551181102362,0,77.0,72.0
315177,GATEWAY CARE CENTER,EATONTOWN,Monmouth,NJ,3.0,3.0,4.37139,0.7870786516853933,0,52.0,56.0
315364,JERSEY SHORE CENTER,EATONTOWN,Monmouth,NJ,3.0,5.0,3.121,0.7962025316455696,0,42.0,32.0
315387,ALLAIRE REHAB & NURSING,FREEHOLD,Monmouth,NJ,1.0,4.0,5.11875,0.7804597701149426,1,329.0,292.0
315292,"APPLEWOOD VILLAGE, INC",FREEHOLD,Monmouth,NJ,4.0,5.0,6.14343,0.5966666666666666,0,15.0,20.0
315528,"JEWISH HOME FOR REHABILITATION AND NURSING, THE",FREEHOLD,Monmouth,NJ,4.0,3.0,3.97815,0.9273333333333333,0,21.0,12.0
315153,"MANOR, THE",FREEHOLD,Monmouth,NJ,4.0,4.0,4.3178,0.4585365853658536,0,25.0,32.0
315504,WEDGWOOD GARDENS CARE CENTER,FREEHOLD,Monmouth,NJ,3.0,4.0,3.48419,0.6370860927152318,0,44.75,24.0
315314,ANCHOR CARE AND REHABILITATION CENTER,HAZLET,Monmouth,NJ,4.0,5.0,3.21436,0.8535294117647059,0,27.0,24.0
315119,ARNOLD WALTER NURSING & REHABILITATION CENTER,HAZLET,Monmouth,NJ,3.0,5.0,3.13955,0.694059405940594,0,60.0,68.0
315092,CAREONE AT HOLMDEL,HOLMDEL,Monmouth,NJ,4.0,5.0,3.64661,0.7138461538461538,0,31.0,24.0
315252,Complete Care at Bayshore LLC,HOLMDEL,Monmouth,NJ,3.0,5.0,3.16602,0.6064655172413793,0,43.0,36.0
315437,LAUREL BAY HEALTH & REHABILITATION CENTER,KEANSBURG,Monmouth,NJ,1.0,2.0,3.59856,0.6772357723577236,0,125.25,163.0
315374,DE LA SALLE HALL,LINCROFT,Monmouth,NJ,5.0,,6.14783,0.725,0,9.0,8.0
315284,"COMPLETE CARE AT MONMOUTH, LLC",LONG BRANCH,Monmouth,NJ,2.0,4.0,3.74886,0.6816666666666666,0,74.0,76.0
315282,EXCEL CARE AT MANALAPAN,MANALAPAN,Monmouth,NJ,1.0,5.0,3.58787,0.8371212121212122,0,164.5,56.0
315015,"COMPLETE CARE AT MADISON, LLC",MATAWAN,Monmouth,NJ,3.0,5.0,3.69109,0.7916167664670658,0,41.0,40.0
315463,MEADOWBROOK RESPIRATORY AND NURSING CENTER,MATAWAN,Monmouth,NJ,2.0,3.0,4.25214,0.7615384615384615,0,84.5,40.0
315199,IMPERIAL CARE CENTER,NEPTUNE,Monmouth,NJ,5.0,5.0,3.90003,0.7289256198347107,0,6.0,8.0
315056,JERSEY SHORE POST ACUTE REHABILITATION AND NURSING,NEPTUNE,Monmouth,NJ,3.0,3.0,3.638,0.8514285714285715,0,36.75,12.0
315299,KING MANOR CARE AND REHABILITATION CENTER,NEPTUNE,Monmouth,NJ,4.0,3.0,3.56531,0.8450000000000001,0,37.0,44.0
315105,CORAL HARBOR REHABILITATION AND HEALTHCARE CENTER,NEPTUNE CITY,Monmouth,NJ,3.0,3.0,3.4671,0.8409090909090909,0,39.0,44.0
315365,COMPLETE CARE AT OCEAN GROVE LLC,OCEAN GROVE,Monmouth,NJ,2.0,4.0,3.08412,0.6040816326530613,0,74.0,80.0
315515,"ATRIUM AT NAVESINK HARBOR, THE",RED BANK,Monmouth,NJ,3.0,5.0,5.04454,0.8744186046511628,0,48.0,52.0
315286,REDBANK CENTER FOR REHABILITATION AND HEALING,RED BANK,Monmouth,NJ,2.0,4.0,3.3208,0.7955555555555555,0,82.0,68.0
315136,COMPLETE CARE AT SHREWSBURY LLC,SHREWSBURY,Monmouth,NJ,2.0,4.0,3.2658,0.8021428571428572,0,78.75,60.0
315414,ASTER CREEK NURSING AND REHABILITATION CENTER,TINTON FALLS,Monmouth,NJ,3.0,3.0,5.00604,0.6859999999999999,0,41.0,48.0
315469,CONTINUING CARE AT SEABROOK,TINTON FALLS,Monmouth,NJ,5.0,4.0,5.12398,0.7034883720930233,0,5.0,4.0
315485,CAREONE AT WALL,WALL,Monmouth,NJ,2.0,5.0,3.40442,0.7623076923076922,0,82.25,32.0
315501,COMPLETE CARE AT WALL LLC,WALL,Monmouth,NJ,1.0,5.0,3.42534,0.6061538461538462,0,108.0,144.0
315354,SUNNYSIDE MANOR,WALL,Monmouth,NJ,4.0,4.0,4.81356,0.8833333333333333,0,23.0,28.0
315069,TOWER LODGE CARE CENTER,WALL,Monmouth,NJ,4.0,,3.59348,0.8883333333333333,0,33.0,36.0
315492,FALLSVIEW NURSING AND REHABILITATION CENTER,BOONTON,Morris,NJ,3.0,5.0,3.58387,0.7547008547008547,0,54.0,48.0
315120,CHATHAM HILLS SUBACUTE CARE CENTER,CHATHAM,Morris,NJ,3.0,5.0,3.37797,0.8481481481481481,0,59.0,52.0
315329,"OAKS AT DENVILLE, THE",DENVILLE,Morris,NJ,3.0,5.0,5.30002,0.680952380952381,0,47.0,40.0
315019,DWELLING PLACE AT ST CLARES,DOVER,Morris,NJ,4.0,,2.2159,0.9678571428571429,0,24.0,28.0
315355,EXCEL CARE AT DOVER,DOVER,Morris,NJ,1.0,3.0,3.74751,0.864516129032258,0,112.25,76.0
315529,LIVIA HEALTH AND SENIOR LIVING,EAST HANOVER,Morris,NJ,4.0,5.0,4.06209,0.8651162790697675,0,30.0,16.0
315383,CHESHIRE HOME,FLORHAM PARK,Morris,NJ,4.0,,6.07384,0.9314285714285715,0,32.0,36.0
315530,FLORHAM PARK REHABILITATION AND HEALTHCARE CENTER,FLORHAM PARK,Morris,NJ,5.0,5.0,3.18453,0.9528301886792453,0,4.0,4.0
315072,Heath Village,HACKETTSTOWN,Morris,NJ,5.0,3.0,5.02109,0.8898148148148147,0,13.0,8.0
315249,LINCOLN PARK CARE CENTER,LINCOLN PARK,Morris,NJ,4.0,,3.73655,0.9712979890310786,0,34.0,28.0
315042,LINCOLN PARK RENAISSANCE,LINCOLN PARK,Morris,NJ,3.0,5.0,3.31192,0.9354497354497355,0,45.0,44.0
315053,PINE ACRES REHABILITATION AND HEALTHCARE,MADISON,Morris,NJ,4.0,4.0,3.705,0.8137254901960784,0,20.0,16.0
315143,HOLLY MANOR CENTER,MENDHAM,Morris,NJ,2.0,5.0,3.25533,0.6959677419354838,0,78.0,76.0
315488,CareOne At Madison Avenue,MORRISTOWN,Morris,NJ,2.0,5.0,3.87486,0.5870786516853933,0,87.0,112.0
315303,MORRIS VIEW HEALTHCARE CENTER,MORRISTOWN,Morris,NJ,1.0,5.0,4.19872,0.8911660777385159,0,134.75,96.0
315157,MORRISTOWN POST ACUTE REHAB AND NURSING CENTER,MORRISTOWN,Morris,NJ,2.0,5.0,4.10591,0.6979094076655052,0,63.0,60.0
315138,TROY HILLS CENTER,PARSIPPANY,Morris,NJ,1.0,3.0,3.39043,0.6453846153846154,0,234.0,132.0
315468,CAREONE AT PARSIPPANY,PARSIPPANY TROY HILL,Morris,NJ,4.0,4.0,3.07058,0.7254237288135593,0,33.0,36.0
315491,CEDAR CREST/MOUNTAINVIEW GARDENS,POMPTON PLAINS,Morris,NJ,1.0,5.0,4.62506,0.9672566371681416,1,109.25,135.0
315057,MERRY HEART NURSING HOME,SUCCASUNNA,Morris,NJ,4.0,5.0,4.09869,0.8495575221238938,0,22.0,20.0
315511,CareOne At Hanover Township,WHIPPANY,Morris,NJ,2.0,5.0,3.86201,0.75,0,78.75,40.0
315222,BARNEGAT REHABILITATION AND NURSING CENTER,BARNEGAT,Ocean,NJ,2.0,3.0,3.72191,0.8356521739130435,1,38.0,28.0
315125,CRYSTAL LAKE HEALTHCARE AND REHABILITATION,BAYVILLE,Ocean,NJ,,,5.16623,0.816595744680851,1,349.75,225.0
315462,TALLWOODS CARE CENTER,BAYVILLE,Ocean,NJ,3.0,4.0,3.32879,0.7966666666666667,0,59.0,60.0
315342,COMPLETE CARE AT BRICK LLC,BRICK,Ocean,NJ,3.0,4.0,4.01033,0.5598540145985401,0,55.0,40.0
315274,"COMPLETE CARE AT LAURELTON, LLC",BRICK,Ocean,NJ,2.0,4.0,3.75627,0.5577777777777778,0,102.0,40.0
315453,COMPLETE CARE AT SHORROCK,BRICK,Ocean,NJ,2.0,4.0,3.30482,0.9294444444444445,0,93.5,64.0
315213,WILLOW SPRINGS REHABILITATION AND HEALTHCARE CTR,BRICK,Ocean,NJ,4.0,4.0,3.24592,0.8804878048780488,0,36.0,28.0
315288,BARTLEY NURSING & REHAB,JACKSON,Ocean,NJ,4.0,5.0,3.4828,0.9055555555555556,0,20.0,16.0
315115,ATLANTIC COAST REHAB & HEALTH,LAKEWOOD,Ocean,NJ,3.0,,3.38609,0.8412499999999999,0,42.0,48.0
315275,CONCORD HEALTHCARE & REHABILITATION CENTER,LAKEWOOD,Ocean,NJ,4.0,4.0,3.96232,0.7933333333333333,0,16.0,16.0
315327,FOUNTAINVIEW CARE CENTER,LAKEWOOD,Ocean,NJ,1.0,5.0,3.81908,0.7308943089430895,1,111.25,135.0
315262,HARROGATE,LAKEWOOD,Ocean,NJ,4.0,5.0,4.95623,0.8897058823529411,0,30.0,36.0
315190,LEISURE CHATEAU REHABILITATION,LAKEWOOD,Ocean,NJ,4.0,4.0,4.2356,0.759090909090909,0,24.0,16.0
315456,MYSTIC MEADOWS REHABILITATION AND NURSING CENTER,LITTLE EGG HARBOR TW,Ocean,NJ,4.0,3.0,3.91351,0.7946153846153846,0,24.0,28.0
315218,SEACREST REHABILITATION AND HEALTHCARE CENTER,LITTLE EGG HARBOR TW,Ocean,NJ,2.0,5.0,3.22317,0.895906432748538,0,71.0,84.0
315206,MANAHAWKIN HEALTH AND REHABILITATION CENTER,MANAHAWKIN,Ocean,NJ,1.0,1.0,4.16937,0.935,0,199.25,227.0
315332,SOUTHERN OCEAN CENTER,MANAHAWKIN,Ocean,NJ,4.0,4.0,3.42879,0.8911764705882353,0,36.0,36.0
315196,ARISTACARE AT MANCHESTER,MANCHESTER,Ocean,NJ,4.0,4.0,3.77221,0.8678787878787878,0,38.0,28.0
315135,CREST POINTE REHABILITATION AND HEALTHCARE CENTER,PT PLEASANT,Ocean,NJ,1.0,1.0,3.52429,0.8449152542372882,0,108.25,52.0
315443,CHILDRENS SPECIALIZED HOSPITAL TOMS RIVER,TOMS RIVER,Ocean,NJ,4.0,,5.85892,0.5769230769230769,0,19.0,20.0
315490,COMMUNITY MEDICAL CENTER TCU,TOMS RIVER,Ocean,NJ,5.0,4.0,6.25832,0.836,0,16.0,16.0
315333,COMPLETE CARE AT ARBORS,TOMS RIVER,Ocean,NJ,3.0,5.0,2.86936,0.865,0,41.0,44.0
315264,"COMPLETE CARE AT BEY LEA, LLC",TOMS RIVER,Ocean,NJ,4.0,4.0,3.0543,0.8049999999999999,0,28.0,32.0
315265,COMPLETE CARE AT GREEN ACRES,TOMS RIVER,Ocean,NJ,5.0,5.0,3.27488,0.944311377245509,0,15.0,8.0
315320,COMPLETE CARE AT HOLIDAY CITY,TOMS RIVER,Ocean,NJ,3.0,4.0,3.1443,0.7844444444444444,0,40.0,28.0
315312,Hampton Ridge Healthcare and Rehabilitation,TOMS RIVER,Ocean,NJ,5.0,4.0,3.10627,0.9735294117647059,0,8.0,4.0
315421,ROSE GARDEN NURSING AND REHABILITATION CENTER,TOMS RIVER,Ocean,NJ,2.0,3.0,3.59409,0.91875,1,76.0,88.0
315454,SHORE GARDENS REHABILITATION AND NURSING CENTER,TOMS RIVER,Ocean,NJ,1.0,2.0,4.2628,0.9449664429530202,0,136.75,128.0
315309,ARISTACARE AT WHITING,WHITING,Ocean,NJ,1.0,5.0,3.39702,0.7427777777777778,0,203.25,243.0
315298,CRESTWOOD MANOR,WHITING,Ocean,NJ,4.0,5.0,4.25845,0.7953125,0,23.0,20.0
315347,HAMILTON PLACE AT THE PINES AT WHITING,WHITING,Ocean,NJ,3.0,2.0,3.98273,0.7893939393939394,0,44.0,52.0
315293,WHITING GARDENS REHABILITATION AND NURSING CENTER,WHITING,Ocean,NJ,1.0,2.0,3.50737,0.9055,1,251.0,226.0
315348,HEALTH CENTER AT BLOOMINGDALE,BLOOMINGDALE,Passaic,NJ,4.0,4.0,3.79608,0.8566666666666667,0,32.0,20.0
315021,ATLAS HEALTHCARE AT DAUGHTERS OF MIRIAM,CLIFTON,Passaic,NJ,2.0,5.0,3.29818,0.9257142857142857,0,86.5,84.0
315261,LAKELAND NURSING & REHAB,HASKELL,Passaic,NJ,3.0,4.0,,0.6756218905472637,0,53.0,64.0
315229,Phoenix Center for Rehabilitation and Pediatrics,HASKELL,Passaic,NJ,3.0,2.0,2.81788,0.9171806167400881,0,49.0,44.0
315531,HOLLAND CHRISTIAN HOME ASSOCIATION,NORTH HALEDON,Passaic,NJ,,,,,0,,
315085,COMPLETE CARE AT CHESTNUT HILL LLC,PASSAIC,Passaic,NJ,1.0,3.0,3.12677,0.9405405405405406,0,316.5,402.0
315221,"COMPLETE CARE AT HAMILTON, LLC",PASSAIC,Passaic,NJ,2.0,2.0,3.84048,0.8674999999999999,0,62.0,32.0
315507,"Barnert Subacute Rehabilitation Center, Llc",PATERSON,Passaic,NJ,4.0,1.0,4.12586,0.9102941176470588,0,33.0,40.0
315331,COMPLETE CARE AT FAIR LAWN EDGE,PATERSON,Passaic,NJ,3.0,1.0,3.8738,0.9705555555555555,0,46.75,28.0
315096,"DOCTORS SUBACUTE HEALTHCARE, LLC",PATERSON,Passaic,NJ,4.0,3.0,3.90475,0.8481481481481481,0,25.0,24.0
315234,ARBOR RIDGE REHABILITATION AND HEALTHCARE CENTER,WAYNE,Passaic,NJ,3.0,5.0,3.45094,0.885,0,37.0,44.0
315335,Alps at Wayne Rehab & Care Center,WAYNE,Passaic,NJ,3.0,3.0,4.09179,0.6803827751196172,0,52.75,32.0
315291,Avalon Rehab and Care Center,WAYNE,Passaic,NJ,4.0,,3.39379,0.9052941176470588,0,27.0,24.0
315477,CAREONE AT WAYNE,WAYNE,Passaic,NJ,5.0,5.0,3.19842,0.8267326732673267,0,12.0,16.0
315110,COMPLETE CARE AT WAYNE HILLS REHAB & RESP CENTER,WAYNE,Passaic,NJ,3.0,1.0,2.42763,0.8725,0,57.0,60.0
315103,EXCEL CARE AT WAYNE,WAYNE,Passaic,NJ,5.0,4.0,2.79297,0.855,0,18.0,20.0
315142,LLANFAIR HOUSE CARE & REHABILITATION CENTER,WAYNE,Passaic,NJ,2.0,2.0,3.88164,0.5616666666666666,0,76.0,84.0
315361,Preakness Healthcare Center,WAYNE,Passaic,NJ,2.0,1.0,4.16127,0.6950738916256157,0,101.75,88.0
315276,COMPLETE CARE AT MILFORD MANOR LLC,WEST MILFORD,Passaic,NJ,2.0,3.0,3.555,0.8741666666666668,0,81.0,92.0
315356,SKILLED NURSING AT FELLOWSHIP VILLAGE,BASKING RIDGE,Somerset,NJ,5.0,4.0,5.73695,0.8805970149253731,0,1.0,0.0
315002,CAREONE AT SOMERSET VALLEY,BOUND BROOK,Somerset,NJ,3.0,5.0,2.86409,0.73125,0,47.0,60.0
315182,BRIDGEWAY CARE AND REHAB CENTER AT BRIDGEWATER,BRIDGEWATER,Somerset,NJ,2.0,4.0,4.25392,0.9198675496688742,1,76.25,87.0
315134,COMPLETE CARE AT GREEN KNOLL,BRIDGEWATER,Somerset,NJ,3.0,5.0,3.11118,0.8409090909090909,0,51.75,36.0
315419,N J EASTERN STAR HOME,BRIDGEWATER,Somerset,NJ,4.0,5.0,4.39224,0.8841463414634146,0,19.0,16.0
315445,The Arbor at Laurel Circle,BRIDGEWATER,Somerset,NJ,2.0,5.0,4.47977,0.653125,0,74.0,72.0
315141,ABINGDON CARE & REHABILITATION CENTER,GREEN BROOK,Somerset,NJ,1.0,5.0,3.75908,0.5755555555555555,0,159.0,108.0
315510,BRIDGEWAY CARE AND REHAB CENTER AT HILLSBOROUGH,HILLSBOROUGH,Somerset,NJ,2.0,3.0,4.0675,0.961111111111111,0,67.0,76.0
315425,FOOTHILL ACRES REHABILITATION & NURSING CENTER,HILLSBOROUGH,Somerset,NJ,2.0,4.0,4.31618,0.8140000000000001,0,75.0,96.0
315140,WATERFRONT REHABILITATION AND HEALTHCARE CENTER,RARITAN,Somerset,NJ,4.0,5.0,3.39691,0.9608695652173913,0,34.0,12.0
315486,STONEBRIDGE AT MONTGOMERY HEALTH CARE CENTER,SKILLMAN,Somerset,NJ,2.0,5.0,3.74527,1.088,0,94.0,124.0
315253,"PARKER AT SOMERSET, INC",SOMERSET,Somerset,NJ,5.0,4.0,6.44281,0.9333333333333333,0,15.0,20.0
315367,REGENCY HERITAGE NURSING AND REHABILITATION CENTER,SOMERSET,Somerset,NJ,4.0,5.0,3.63835,0.7120754716981131,0,20.0,24.0
315520,SOMERSET WOODS REHABILITATION & NURSING CENTER,SOMERSET,Somerset,NJ,1.0,4.0,3.7925,0.7398648648648649,1,242.25,319.0
315337,MCAULEY HALL HEALTH CARE CENTE,WATCHUNG,Somerset,NJ,4.0,4.0,,0.8972972972972973,0,37.0,20.0
315044,MOHAWK MEADOWS,LAFAYETTE,Sussex,NJ,1.0,4.0,3.18665,0.9289308176100628,0,176.5,44.0
315137,COMPLETE CARE AT BARN HILL,NEWTON,Sussex,NJ,4.0,5.0,3.30523,0.8714285714285713,0,29.0,20.0
315378,HOMESTEAD REHABILITATION & HEALTH CARE CENTER,NEWTON,Sussex,NJ,1.0,5.0,3.24457,0.42265625,0,193.5,200.0
315439,UNITED METHODIST COMMUNITIES AT BRISTOL GLEN,NEWTON,Sussex,NJ,4.0,3.0,3.96529,0.8883333333333333,0,22.0,28.0
315409,VALLEY VIEW REHABILITATION AND HEALTHCARE CTR,NEWTON,Sussex,NJ,1.0,5.0,4.69156,0.5645161290322581,0,148.0,176.0
315195,AUTUMN LAKE HEALTHCARE AT BERKELEY HEIGHTS,BERKELEY HEIGHTS,Union,NJ,3.0,5.0,3.66637,0.8584615384615384,0,57.0,16.0
315009,RUNNELLS CENTER FOR REHABILITATION & HEALTHCARE,BERKELEY HEIGHTS,Union,NJ,4.0,4.0,5.20776,0.8193333333333334,0,32.0,32.0
315341,COMPLETE CARE AT CLARK LLC,CLARK,Union,NJ,4.0,5.0,3.19765,0.9285714285714286,0,33.0,24.0
315091,BIRCHWOOD REHABILITATION AND HEALTHCARE CENTER,CRANFORD,Union,NJ,4.0,4.0,3.36048,0.9125,0,31.0,20.0
315390,CRANFORD PARK CARE,CRANFORD,Union,NJ,2.0,3.0,,0.6970000000000001,0,95.0,112.0
315106,ELIZABETH NURSING AND REHAB,ELIZABETH,Union,NJ,4.0,4.0,3.84141,0.8862745098039216,0,20.0,24.0
315010,ELMORA HILLS HEALTH & REHABILITATION CENTER,ELIZABETH,Union,NJ,2.0,3.0,3.3614,0.9490000000000001,0,82.0,96.0
315483,Plaza Healthcare & Rehabilitation Center,ELIZABETH,Union,NJ,4.0,5.0,4.23402,0.70703125,0,18.0,16.0
315442,TRINITAS HOSPITAL,ELIZABETH,Union,NJ,3.0,2.0,4.44802,0.7266129032258064,0,38.0,48.0
315200,ARISTACARE AT PARKSIDE,LINDEN,Union,NJ,2.0,4.0,3.04369,0.8233333333333334,0,58.0,64.0
315239,CHILDRENS SPECIALIZED HOSPITAL MOUNTAINSIDE,MOUNTAINSIDE,Union,NJ,4.0,,3.57117,0.8222222222222222,0,24.0,20.0
315259,MOUNTAINSIDE SKILLED NURSING AND REHAB,MOUNTAINSIDE,Union,NJ,1.0,5.0,3.41958,0.8947019867549668,1,143.25,175.0
315523,CONTINUING CARE AT LANTERN HILL,NEW PROVIDENCE,Union,NJ,2.0,3.0,5.47677,0.96,0,83.25,111.0
315005,SPRING GROVE REHABILITATION AND HEALTHCARE CENTER,NEW PROVIDENCE,Union,NJ,3.0,4.0,3.41581,0.9311320754716982,0,56.0,60.0
