335040,PINE FOREST CARE CENTER FOR REHAB & HEALTHCARE,HUNTINGTON,Suffolk,NY,1.0,3.0,2.53789,0.9776315789473684,0,199.0,252.0
335067,APEX REHABILITATION & CARE CENTER,HUNTINGTON STATION,Suffolk,NY,2.0,5.0,3.30092,0.9615384615384616,0,71.0,72.0
335487,ST JOHNLAND NURSING CENTER INC,KINGS PARK,Suffolk,NY,1.0,5.0,3.7892,0.8052,1,142.75,177.0
335840,Medford Multicare Center For Living,MEDFORD,Suffolk,NY,1.0,2.0,2.6429,0.8746875,0,92.25,28.0
335818,HUNTINGTON HILLS CTR FOR HEALTH AND REHABILITATION,MELVILLE,Suffolk,NY,3.0,5.0,3.07735,0.9265625,0,37.0,44.0
335719,QUANTUM REHABILITATION AND NURSING L L C,MIDDLE ISLAND,Suffolk,NY,5.0,5.0,2.99191,0.9141666666666667,0,6.0,4.0
335390,SURGE REHABILITATION AND NURSING LLC,MIDDLE ISLAND,Suffolk,NY,5.0,5.0,3.60681,0.8310975609756098,0,11.0,8.0
335674,THE HAMLET REHABILITATION AND HEALTHCARE CENTER AT,NESCONSET,Suffolk,NY,4.0,5.0,2.76381,0.9741666666666667,0,19.0,12.0
335839,AFFINITY SKILLED LIVING AND REHABILITATION CENTER,OAKDALE,Suffolk,NY,3.0,5.0,3.1366,0.9075,0,36.0,32.0
335596,SWAN LAKE NURSING & REHABILITATION,PATCHOGUE,Suffolk,NY,1.0,4.0,1.61207,0.8441666666666666,0,113.75,145.0
335853,JOHN T MATHER MEMORIAL HOSP T C U,PORT JEFFERSON,Suffolk,NY,3.0,5.0,7.85911,0.825,0,30.0,36.0
335410,WATERS EDGE AT PORT JEFFERSON FOR REHAB AND NRSG,PORT JEFFERSON,Suffolk,NY,1.0,5.0,2.73267,0.8758333333333332,0,139.75,165.0
335514,ALLEGRIA NURSING & REHAB CENTER OF PORT JEFFERSON,PORT JEFFERSON STATI,Suffolk,NY,1.0,5.0,,0.9188811188811189,0,70.0,80.0
335254,ACADIA CENTER FOR NURSING AND REHABILITATION,RIVERHEAD,Suffolk,NY,4.0,5.0,3.32981,0.6143646408839779,0,21.0,12.0
335636,GOOD SAMARITAN NURSING AND REHABILITATION CARE CTR,SAYVILLE,Suffolk,NY,5.0,2.0,3.40544,0.7829999999999999,0,8.0,8.0
335761,LUXOR NURSING AND REHABILITATION AT SAYVILLE,SAYVILLE,Suffolk,NY,3.0,4.0,2.51481,0.9527777777777777,0,28.0,32.0
335175,BROOKSIDE MULTICARE NURSING CENTER,SMITHTOWN,Suffolk,NY,4.0,4.0,3.98939,0.8504249291784702,0,14.0,12.0
335756,SMITHTOWN CENTER FOR REHABILITATION & NURSING CARE,SMITHTOWN,Suffolk,NY,3.0,3.0,2.46775,0.9876543209876543,0,36.0,44.0
335821,ST CATHERINE OF SIENA NRSG AND REHAB CARE CENTER,SMITHTOWN,Suffolk,NY,3.0,3.0,4.04579,0.83375,0,35.0,36.0
335850,THE HAMPTONS CENTER FOR REHABILITATION AND NURSING,SOUTH HAMPTON,Suffolk,NY,1.0,4.0,3.34963,0.8875,1,201.75,261.0
335833,JEFFERSON'S FERRY,SOUTH SETAUKET,Suffolk,NY,5.0,5.0,5.0383,0.7733333333333333,0,4.0,0.0
335739,LUXOR NURSING AND REHABILITATION AT MILLS POND,ST JAMES,Suffolk,NY,4.0,5.0,2.67758,0.9468253968253968,0,19.0,20.0
335301,ST JAMES REHABILITATION & HEALTHCARE CENTER,ST JAMES,Suffolk,NY,3.0,4.0,3.13833,0.966086956521739,0,32.0,36.0
335758,LONG ISLAND STATE VETERANS HOME,STONYBROOK,Suffolk,NY,5.0,1.0,4.39965,0.8842857142857142,0,4.0,4.0
335083,BERKSHIRE NURSING & REHABILITATION CENTER,WEST BABYLON,Suffolk,NY,4.0,5.0,2.78557,0.9137142857142857,0,22.0,28.0
335681,EAST NECK NURSING & REHABILITATION CENTER,WEST BABYLON,Suffolk,NY,2.0,5.0,2.74345,0.9053333333333334,0,46.0,44.0
335539,OUR LADY OF CONSOLATION NURSING AND REHAB CARE CTR,WEST ISLIP,Suffolk,NY,2.0,4.0,3.66546,0.6164444444444444,0,57.0,64.0
335782,WESTHAMPTON CARE CENTER,WESTHAMPTON,Suffolk,NY,4.0,4.0,2.89832,0.9422222222222222,0,22.0,20.0
335005,BRIARCLIFF MANOR CENTER FOR REHAB AND NURSING CARE,BRIARCLIFF MANOR,Westchester,NY,1.0,4.0,2.81045,0.9766666666666667,1,88.75,68.0
335441,CORTLANDT HEALTHCARE,CORTLANDT MANOR,Westchester,NY,4.0,5.0,2.85713,0.9341666666666666,0,16.0,8.0
335078,YORKTOWN REHABILITATION & NURSING CENTER,CORTLANDT MANOR,Westchester,NY,3.0,5.0,3.73036,0.6104999999999999,0,38.0,28.0
335508,SKY VIEW REHABILITATION & HEALTH CARE CENTER L L C,CROTON ON HUDSON,Westchester,NY,3.0,5.0,2.93361,0.9036458333333334,0,28.0,32.0
335806,SPRINGVALE NURSING & REHABILITATION CENTER,CROTON ON HUDSON,Westchester,NY,1.0,5.0,4.09684,0.9365000000000001,1,79.0,80.0
335383,ST CABRINI NURSING HOME,DOBBS FERRY,Westchester,NY,3.0,3.0,3.65257,0.955921052631579,0,41.0,32.0
335795,ANDRUS ON HUDSON,HASTINGS ON HUDSON,Westchester,NY,3.0,4.0,3.43477,0.9730964467005075,0,31.0,24.0
335296,Sarah Neuman Center for Rehabilitation and Nursing,MAMARONECK,Westchester,NY,1.0,5.0,3.26012,0.925,1,108.0,132.0
335342,NORTH WESTCHESTER RESTORATIVE THERAPY & NRSG CRT,MOHEGAN LAKE,Westchester,NY,3.0,5.0,3.49665,0.9233333333333333,0,27.0,28.0
335832,NEW YORK STATE VETERANS HOME AT MONTROSE,MONTROSE,Westchester,NY,1.0,3.0,4.49371,0.8027777777777778,0,74.0,96.0
335269,The Wartburg Home,MOUNT VERNON,Westchester,NY,3.0,5.0,4.70319,0.20761904761904762,0,37.0,40.0
335459,WESTCHESTER CENTER FOR REHABILITATION & NURSING,MOUNT VERNON,Westchester,NY,1.0,5.0,3.62949,0.9754166666666666,0,102.0,112.0
335614,BAYBERRY NURSING HOME,NEW ROCHELLE,Westchester,NY,4.0,5.0,3.72066,0.9266666666666666,0,11.0,12.0
335271,DUMONT CENTER FOR REHABILITATION AND NURSING CARE,NEW ROCHELLE,Westchester,NY,2.0,4.0,2.58277,0.9556122448979593,0,48.0,60.0
335611,GLEN ISLAND CENTER FOR NURSING AND REHABILITATION,NEW ROCHELLE,Westchester,NY,2.0,2.0,2.89157,0.9633879781420766,0,43.0,32.0
335337,SCHAFFER EXTENDED CARE CENTER,NEW ROCHELLE,Westchester,NY,1.0,3.0,3.6247,0.8826666666666667,0,128.5,162.0
335350,SUTTON PARK CENTER FOR NURSING AND REHABILITATION,NEW ROCHELLE,Westchester,NY,3.0,2.0,2.72511,0.93,0,29.0,24.0
335621,UNITED HEBREW GERIATRIC CENTER,NEW ROCHELLE,Westchester,NY,4.0,5.0,3.75851,0.5717687074829931,0,14.0,16.0
335490,BETHEL NURSING HOME COMPANY INC,OSSINING,Westchester,NY,2.0,5.0,4.19439,0.7790697674418605,0,54.0,60.0
335185,CEDAR MANOR NURSING & REHABILITATION CENTER,OSSINING,Westchester,NY,1.0,3.0,2.88481,0.9006535947712418,1,73.0,80.0
335667,SUNSHINE CHILDREN'S HOME AND REHAB CENTER,OSSINING,Westchester,NY,5.0,,5.03807,0.9959016393442623,0,5.0,0.0
335003,THE EMERALD PEEK REHABILITATION AND NURSING CENTER,PEEKSKILL,Westchester,NY,2.0,5.0,2.7122,0.8859999999999999,0,51.0,40.0
335447,KING STREET HOME INC,PORT CHESTER,Westchester,NY,2.0,5.0,4.68437,0.5091666666666667,0,62.0,80.0
335312,THE ENCLAVE AT RYE  REHAB AND NURSING CTR,PORT CHESTER,Westchester,NY,3.0,5.0,2.61273,0.944375,0,23.0,28.0
335259,WATERVIEW HILLS REHABILITATION AND NURSING CENTER,PURDY STATION,Westchester,NY,3.0,5.0,2.90607,0.893076923076923,0,27.0,36.0
335687,SALEM HILLS REHABILITATION AND NURSING CENTER,PURDYS,Westchester,NY,3.0,3.0,2.6431,0.9626984126984127,0,27.0,36.0
335797,THE OSBORN,RYE,Westchester,NY,3.0,5.0,4.49409,0.9047619047619048,0,35.0,32.0
335320,SPRAIN BROOK MANOR REHAB,SCARSDALE,Westchester,NY,4.0,4.0,2.92097,0.868595041322314,0,16.0,20.0
335848,KENDAL ON HUDSON,SLEEPY HOLLOW,Westchester,NY,4.0,5.0,5.43386,0.8999999999999999,0,20.0,24.0
335261,THE PARAMOUNT AT SOMERS REHAB AND NURSING CENTER,SOMERS,Westchester,NY,1.0,5.0,2.52944,0.9253333333333335,0,81.0,88.0
335421,TARRYTOWN HALL CARE CENTER,TARRYTOWN,Westchester,NY,3.0,3.0,3.61666,0.9608333333333333,0,33.0,44.0
335809,THE GROVE AT VALHALLA REHAB AND NURSING CENTER,VALHALLA,Westchester,NY,1.0,5.0,2.58454,1.0074999999999998,0,81.0,84.0
335844,THE KNOLLS,VALHALLA,Westchester,NY,5.0,5.0,5.33161,0.825,0,9.0,0.0
335874,THE STEVEN AND ALEXANDRA COHEN PED L T C PAVILION,VALHALLA,Westchester,NY,5.0,,3.66637,0.9541666666666666,0,3.0,4.0
335878,EPIC REHABILITATION AND NURSING AT WHITE PLAINS,WHITE PLAINS,Westchester,NY,2.0,5.0,3.27168,0.8574999999999999,0,63.0,80.0
335424,MARTINE CENTER FOR REHABILITATION AND NURSING,WHITE PLAINS,Westchester,NY,2.0,1.0,4.16229,0.8457777777777779,0,70.0,72.0
335224,"WHITE PLAINS CENTER FOR NURSING CARE, L L C",WHITE PLAINS,Westchester,NY,4.0,5.0,4.20302,0.9352272727272727,0,16.0,20.0
335829,ADIRA AT RIVERSIDE REHABILITATION AND NURSING,YONKERS,Westchester,NY,1.0,5.0,2.98285,0.8891666666666667,0,105.0,132.0
33A246,ELIZABETH SETON CHILDREN'S CENTER,YONKERS,Westchester,NY,4.0,,5.11755,0.9834319526627219,0,19.0,12.0
335080,HUDSON HILL CENTER FOR REHABILITATION & NURSING,YONKERS,Westchester,NY,1.0,,2.91406,0.8911111111111111,1,163.75,160.0
335398,SANS SOUCI REHABILITATION AND NURSING CENTER,YONKERS,Westchester,NY,1.0,4.0,2.56787,0.9291666666666667,1,107.0,132.0
335515,YONKERS GARDENS CENTER FOR NURSING AND REHAB,YONKERS,Westchester,NY,1.0,1.0,3.09925,0.893,1,139.0,115.0
