315217,ARISTACARE AT NORWOOD TERRACE,PLAINFIELD,Union,NJ,4.0,5.0,3.58557,0.7741666666666667,0,18.0,16.0
315101,COMPLETE CARE AT PLAINFIELD LLC,PLAINFIELD,Union,NJ,4.0,5.0,3.27586,0.960377358490566,0,17.0,8.0
315273,COMPLETE CARE AT WOODLANDS,PLAINFIELD,Union,NJ,4.0,5.0,3.72782,0.89,0,19.0,8.0
315198,ADROIT CARE REHABILITATION AND NURSING CENTER,RAHWAY,Union,NJ,3.0,5.0,3.26812,0.9401639344262296,0,50.0,56.0
315146,CARE CONNECTION RAHWAY,RAHWAY,Union,NJ,5.0,5.0,4.75243,0.9583333333333334,0,3.0,4.0
315064,ASHBROOK CARE & REHABILITATION CENTER,SCOTCH PLAINS,Union,NJ,1.0,3.0,3.84247,0.6543859649122806,0,112.0,108.0
315104,CORNELL HALL CARE & REHABILITATION CENTER,UNION,Union,NJ,2.0,4.0,3.23378,0.6468926553672316,0,66.0,20.0
315283,SOUTH MOUNTAIN HC,VAUXHALL,Union,NJ,2.0,4.0,3.46208,0.9507692307692308,0,71.0,72.0
315122,"COMPLETE CARE AT WESTFIELD, LLC",WESTFIELD,Union,NJ,2.0,5.0,3.50922,0.8674008810572688,0,62.75,20.0
335583,ARCHCARE AT PROVIDENCE REST,BRONX,Bronx,NY,5.0,5.0,2.81028,0.9734999999999999,0,9.0,0.0
335373,BAINBRIDGE NURSING & REHABILITATION CENTER,BRONX,Bronx,NY,4.0,5.0,3.3599,0.966,0,14.0,16.0
335201,BETH ABRAHAM CENTER FOR REHABILITATION AND NURSING,BRONX,Bronx,NY,2.0,3.0,3.78118,0.9591517857142857,0,47.0,56.0
335506,BRONX CENTER FOR REHABILITATION & HEALTH CARE,BRONX,Bronx,NY,4.0,4.0,3.36845,0.9790000000000001,0,17.0,16.0
335775,BRONX GARDENS REHABILITATION AND NURSING CENTER,BRONX,Bronx,NY,2.0,5.0,2.77672,0.9748743718592965,0,47.0,56.0
335358,BRONX PARK REHABILITATION & NURSING CENTER,BRONX,Bronx,NY,4.0,3.0,2.88193,0.9600000000000001,0,16.0,20.0
335753,BRONXCARE SPECIAL CARE CENTER,BRONX,Bronx,NY,4.0,3.0,3.15333,0.9404166666666666,0,22.0,16.0
335780,CASA PROMESA,BRONX,Bronx,NY,1.0,,6.07701,0.7861111111111112,0,100.25,111.0
335493,CONCOURSE REHABILITATION AND NURSING CENTER INC,BRONX,Bronx,NY,2.0,2.0,2.63627,0.96875,0,45.0,60.0
335723,EAST HAVEN NURSING & REHABILITATION CENTER,BRONX,Bronx,NY,2.0,3.0,2.94665,0.9555,0,60.0,68.0
335214,EASTCHESTER REHABILITATION AND HEALTH CARE CENTER,BRONX,Bronx,NY,5.0,4.0,,0.9235,0,10.0,8.0
335659,FORDHAM NURSING AND REHABILITATION CENTER,BRONX,Bronx,NY,3.0,3.0,2.61371,0.9600000000000001,0,23.0,28.0
335079,GOLD CREST CARE CENTER,BRONX,Bronx,NY,4.0,3.0,3.98636,0.9474285714285715,0,22.0,20.0
335744,GRAND MANOR NURSING & REHABILITATION CENTER,BRONX,Bronx,NY,,,3.27297,0.8216666666666667,0,335.75,108.0
335751,HIGHBRIDGE WOODYCREST CENTER,BRONX,Bronx,NY,4.0,4.0,4.06822,0.9688888888888889,0,14.0,12.0
335725,HOPE CENTER FOR H I V AND NURSING CARE,BRONX,Bronx,NY,1.0,,3.70274,0.9696969696969697,0,84.0,84.0
335187,HUDSON POINTE AT RIVERDALE CTR FOR NURSING & REHAB,BRONX,Bronx,NY,2.0,2.0,3.18862,0.9239520958083833,0,55.25,16.0
335644,KINGS HARBOR MULTICARE CENTER,BRONX,Bronx,NY,4.0,3.0,3.27997,0.8619444444444445,0,17.0,4.0
335388,LACONIA NURSING HOME,BRONX,Bronx,NY,2.0,5.0,3.04896,0.9791666666666666,0,62.0,80.0
335524,METHODIST HOME FOR NURSING AND REHABILITATION,BRONX,Bronx,NY,5.0,5.0,3.31015,0.9,0,6.0,4.0
335484,MORNINGSIDE NURSING AND REHABILITATION CENTER,BRONX,Bronx,NY,2.0,4.0,2.85728,0.7860103626943005,0,46.0,52.0
335347,MORRIS PARK REHABILITATION AND NURSING CENTER,BRONX,Bronx,NY,2.0,4.0,3.06605,0.9387434554973823,0,47.0,32.0
335030,MOSHOLU PARKWAY NURSING & REHABILITATION CENTER,BRONX,Bronx,NY,1.0,5.0,3.28412,0.9606557377049181,0,76.0,84.0
335695,Manhattanville Health Care Center,BRONX,Bronx,NY,4.0,5.0,2.6409,0.938,0,25.0,20.0
335096,NEW RIVERDALE REHAB AND NURSING,BRONX,Bronx,NY,2.0,3.0,3.08241,0.954109589041096,1,58.0,68.0
335486,PELHAM PARKWAY NURSING CARE & REHAB FACILITY L L C,BRONX,Bronx,NY,3.0,4.0,2.79298,0.9355,0,31.0,28.0
335581,PINNACLE MULTICARE NURSING AND REHAB CENTER,BRONX,Bronx,NY,3.0,4.0,3.24746,0.9760416666666667,0,40.0,40.0
335028,PRESTIGE NURSING CARE & REHAB CENTER,BRONX,Bronx,NY,4.0,,2.81013,0.90125,0,17.0,12.0
335557,REBEKAH REHAB AND EXTENDED CARE CENTER,BRONX,Bronx,NY,2.0,4.0,2.89649,0.956338028169014,0,50.0,56.0
335019,REGEIS CARE CENTER,BRONX,Bronx,NY,4.0,4.0,3.77794,0.9207627118644068,0,14.0,12.0
335015,SCHERVIER NURSING CARE CENTER,BRONX,Bronx,NY,2.0,5.0,3.08662,0.9743169398907104,0,44.0,24.0
335321,SPLIT ROCK REHABILITION AND HEALTH CARE CENTER,BRONX,Bronx,NY,4.0,5.0,2.74712,0.9333333333333333,0,16.0,20.0
335011,ST PATRICKS HOME,BRONX,Bronx,NY,3.0,5.0,2.86143,0.9799242424242424,0,31.0,24.0
335763,ST VINCENT DEPAUL RESIDENCE,BRONX,Bronx,NY,2.0,3.0,,0.3865,0,56.0,56.0
335462,THE PLAZA REHAB AND NURSING CENTER,BRONX,Bronx,NY,4.0,3.0,2.97317,0.8954656862745098,0,25.0,28.0
335771,THROGS NECK EXTENDED CARE FACILITY,BRONX,Bronx,NY,4.0,5.0,,0.9653658536585367,0,25.0,20.0
335445,TRIBORO CENTER FOR REHABILITATION AND NURSING,BRONX,Bronx,NY,3.0,4.0,2.63204,0.7664077669902912,0,25.0,16.0
335061,UNIVERSITY CENTER FOR REHABILITATION AND NURSING,BRONX,Bronx,NY,3.0,4.0,3.24687,0.9260869565217391,0,23.0,24.0
335495,WAYNE CENTER FOR NURSING & REHABILITATION,BRONX,Bronx,NY,3.0,3.0,2.62317,0.9761316872427983,0,39.0,40.0
335048,WILLIAMSBRIDGE CENTER FOR REHABILITATION AND NRSG,BRONX,Bronx,NY,3.0,5.0,3.03688,0.9662337662337663,0,35.0,28.0
335227,WORKMENS CIRCLE MULTICARE CENTER,BRONX,Bronx,NY,5.0,3.0,2.90439,0.9809160305343512,0,11.0,8.0
335020,HEBREW HOME FOR THE AGED AT RIVERDALE,RIVERDALE,Bronx,NY,5.0,5.0,3.27139,0.43202846975088965,0,10.0,0.0
335248,INDEPENDENCE CARE CENTER FOR NURSING AND REHABILIT,RIVERDALE,Bronx,NY,2.0,2.0,4.15327,0.8363157894736842,0,48.0,36.0
335287,PARK GARDENS REHABILITATION & NURSING CENTER L L C,RIVERDALE,Bronx,NY,3.0,5.0,3.24468,0.938,0,25.0,16.0
335720,ATRIUM CENTER FOR REHABILITATION AND NURSING,BROOKLYN,Kings,NY,2.0,5.0,2.83855,0.9626315789473685,0,41.0,44.0
335626,BEDFORD CENTER FOR NURSING AND REHABILITATION,BROOKLYN,Kings,NY,4.0,4.0,3.45361,0.975,0,14.0,12.0
335558,BENSONHURST CENTER FOR REHAB AND HEALTHCARE,BROOKLYN,Kings,NY,4.0,5.0,2.64696,0.9790000000000001,0,16.0,20.0
335470,BORO PARK CENTER FOR REHABILITATION AND HEALTHCARE,BROOKLYN,Kings,NY,2.0,4.0,3.10723,0.9545098039215687,0,39.0,36.0
335178,BROOKLYN CTR FOR REHAB AND RESIDENTIAL HEALTH CARE,BROOKLYN,Kings,NY,2.0,3.0,2.87276,0.9697508896797153,0,49.0,44.0
335070,BROOKLYN GARDENS NURSING & REHABILITATION CENTER,BROOKLYN,Kings,NY,2.0,2.0,3.1979,0.9595833333333333,0,45.0,36.0
335604,BROOKLYN UNITED METHODIST CHURCH HOME,BROOKLYN,Kings,NY,2.0,,3.11828,0.9758333333333333,0,71.0,40.0
335637,BROOKLYN-QUEENS NURSING HOME,BROOKLYN,Kings,NY,2.0,2.0,,0.9735714285714286,0,59.25,20.0
335826,BUENA VIDA REHAB AND NURSING CENTER,BROOKLYN,Kings,NY,5.0,4.0,2.75176,0.95625,0,7.0,0.0
335703,BUSHWICK CENTER FOR REHABILITATION AND HEALTH CARE,BROOKLYN,Kings,NY,1.0,3.0,3.24858,0.9817777777777777,0,67.0,80.0
335245,"CATON PARK REHAB AND NURSING CENTER, L L C",BROOKLYN,Kings,NY,4.0,1.0,2.5718,0.9773109243697479,0,22.0,16.0
335174,COBBLE HILL HEALTH CENTER INC,BROOKLYN,Kings,NY,3.0,5.0,3.48029,0.9837912087912088,0,27.0,28.0
335538,CONCORD NURSING AND REHABILITATION CENTER,BROOKLYN,Kings,NY,4.0,2.0,2.65876,0.9799999999999999,0,20.0,20.0
335609,CROWN HEIGHTS CENTER FOR NURSING AND REHAB,BROOKLYN,Kings,NY,2.0,4.0,3.22466,0.9705084745762712,0,57.0,64.0
335648,DITMAS PARK CARE CENTER,BROOKLYN,Kings,NY,4.0,5.0,3.38071,0.971,0,11.0,8.0
335625,DOWNTOWN BROOKLYN NURSING & REHABILITATION CENTER,BROOKLYN,Kings,NY,4.0,4.0,2.73867,0.9678125,0,22.0,20.0
335805,DR SUSAN SMITH MCKINNEY NURSING AND REHAB CENTER,BROOKLYN,Kings,NY,5.0,4.0,4.80739,0.9690625,0,6.0,8.0
335673,FOUR SEASONS NURSING AND REHABILITATION CENTER,BROOKLYN,Kings,NY,3.0,5.0,2.64142,0.9474074074074075,0,32.0,24.0
335710,HAMILTON PARK NURSING AND REHABILITATION CENTER,BROOKLYN,Kings,NY,3.0,5.0,3.21951,0.9834999999999999,0,33.0,40.0
335656,HAYM SOLOMON HOME FOR THE AGED,BROOKLYN,Kings,NY,4.0,5.0,3.6848,0.9745833333333334,0,20.0,8.0
335847,HOPKINS CENTER FOR REHABILITATION AND HEALTHCARE,BROOKLYN,Kings,NY,5.0,5.0,2.94656,0.9937499999999999,0,10.0,4.0
335545,KING DAVID CENTER FOR NURSING AND REHABILITATION,BROOKLYN,Kings,NY,3.0,4.0,3.42017,0.9697416974169742,0,38.0,44.0
335811,LINDEN CENTER FOR NURSING AND REHABILITATION,BROOKLYN,Kings,NY,4.0,4.0,3.76939,0.9828571428571428,0,21.0,24.0
335653,MENORAH HOME & HOSPITAL FOR AGED & INFIRM,BROOKLYN,Kings,NY,1.0,5.0,3.43351,0.9731651376146789,0,80.0,84.0
335131,"NEW CARLTON REHAB AND NURSING CENTER, L L C",BROOKLYN,Kings,NY,3.0,5.0,3.55597,0.8418918918918918,0,35.0,44.0
335523,NORWEGIAN CHRISTIAN HOME AND HEALTH CENTER,BROOKLYN,Kings,NY,4.0,5.0,3.34307,0.9622222222222223,0,12.0,12.0
335163,OXFORD NURSING HOME,BROOKLYN,Kings,NY,4.0,3.0,4.05152,0.8565957446808511,0,17.0,12.0
335328,PALM GARDENS CENTER FOR NURSING AND REHABILITATION,BROOKLYN,Kings,NY,3.0,1.0,2.82024,0.9633333333333333,0,34.0,28.0
335537,"RUTLAND NURSING HOME, INC",BROOKLYN,Kings,NY,1.0,5.0,3.97797,0.8252788104089219,1,96.0,120.0
335748,SAINTS JOACHIM & ANNE NURSING AND REHAB CENTER,BROOKLYN,Kings,NY,4.0,5.0,2.85604,0.9484999999999999,0,15.0,8.0
335381,SCHULMAN AND SCHACHNE INST FOR NURSING & REHAB,BROOKLYN,Kings,NY,2.0,3.0,3.97546,0.8613839285714285,0,59.0,56.0
335411,SEA CREST NURSING AND REHABILITATION CENTER,BROOKLYN,Kings,NY,4.0,4.0,2.88975,0.898125,0,13.0,8.0
335513,SEAGATE REHABILITATION AND NURSING CENTER,BROOKLYN,Kings,NY,1.0,5.0,2.44081,0.9741666666666666,1,110.75,145.0
335677,SHEEPSHEAD NURSING & REHABILITATION CENTER,BROOKLYN,Kings,NY,2.0,3.0,3.13097,0.95,0,39.0,48.0
335288,SHORE VIEW NURSING  & REHABILITATION CENTER,BROOKLYN,Kings,NY,5.0,5.0,2.86309,0.8884375,0,3.0,4.0
335125,SPRING CREEK REHABILITATION & NURSING CARE CENTER,BROOKLYN,Kings,NY,3.0,4.0,2.8013,1.0305555555555554,0,38.0,40.0
335290,THE CHATEAU AT BROOKLYN REHAB AND NURSING CENTER,BROOKLYN,Kings,NY,4.0,5.0,2.45673,0.9592592592592594,0,15.0,8.0
335104,THE HERITAGE REHABILITATION AND HEALTH CARE CENTER,BROOKLYN,Kings,NY,5.0,4.0,2.9674,0.9518987341772153,0,7.0,8.0
335560,THE MONARCH AT BROOKLYN REHAB AND NURSING CENTER,BROOKLYN,Kings,NY,4.0,5.0,2.87168,0.9784999999999999,0,23.0,16.0
335516,THE PHOENIX REHABILITATION AND NURSING CENTER,BROOKLYN,Kings,NY,4.0,5.0,2.60423,0.9782500000000001,0,11.0,12.0
335140,BELAIR CARE CENTER INC,BELLMORE,Nassau,NY,4.0,5.0,3.20056,0.9529411764705883,0,20.0,20.0
335161,DALEVIEW CARE CENTER,EAST FARMINGDALE,Nassau,NY,3.0,5.0,3.04335,0.8577464788732394,0,33.0,28.0
335831,FULTON COMMONS CARE CENTER INC,EAST MEADOW,Nassau,NY,2.0,3.0,3.34719,0.9732142857142857,0,39.0,32.0
335817,GARDEN CARE CENTER,FRANKLIN SQUARE,Nassau,NY,3.0,5.0,2.69123,0.9486666666666668,0,35.0,28.0
335796,MEADOWBROOK CARE CENTER,FREEPORT,Nassau,NY,4.0,5.0,2.94303,0.9546428571428572,0,14.0,12.0
335156,SOUTH SHORE REHABILITATION AND NURSING CENTER,FREEPORT,Nassau,NY,2.0,5.0,2.85124,0.9159999999999999,0,53.0,52.0
335141,EMERGE NURSING AND REHABILITATION AT GLEN COVE,GLEN COVE,Nassau,NY,5.0,5.0,3.11529,0.8833333333333333,0,10.0,8.0
335716,GLEN COVE CENTER FOR NURSING AND REHABILITATION,GLEN COVE,Nassau,NY,3.0,5.0,3.14911,0.9279220779220779,0,27.0,28.0
335211,GLENGARIFF HEALTH CARE CENTER,GLEN COVE,Nassau,NY,2.0,5.0,2.63215,0.8908396946564886,0,54.0,52.0
335250,HIGHFIELD GARDENS CARE CENTER OF GREAT NECK,GREAT NECK,Nassau,NY,3.0,5.0,3.87402,0.9904999999999999,0,36.0,40.0
335483,THE GRAND REHABILITATION AND NURSING AT GREAT NECK,GREAT NECK,Nassau,NY,1.0,5.0,2.82288,0.9677570093457943,0,71.5,28.0
335808,HEMPSTEAD PARK NURSING HOME,HEMPSTEAD,Nassau,NY,2.0,1.0,3.00923,0.9282868525896414,1,64.75,48.0
335279,MAYFAIR CARE CENTER,HEMPSTEAD,Nassau,NY,2.0,1.0,3.06405,0.9525,0,49.0,44.0
335787,NASSAU REHABILITATION & NURSING CENTER,HEMPSTEAD,Nassau,NY,2.0,5.0,2.83129,1.01,0,53.5,66.0
335162,THE GRAND REHABILITATION AND NURSING AT SOUTH POIN,ISLAND PARK,Nassau,NY,2.0,1.0,3.03486,0.9643243243243244,0,44.0,48.0
335024,BEACH TERRACE CARE CENTER,LONG BEACH,Nassau,NY,3.0,1.0,3.03922,0.9642857142857143,0,34.0,40.0
335498,GRANDELL REHABILITATION AND NURSING CENTER,LONG BEACH,Nassau,NY,4.0,4.0,3.92713,0.9597122302158274,0,11.0,8.0
335432,LONG BEACH NURSING AND REHABILITATION CENTER,LONG BEACH,Nassau,NY,3.0,4.0,2.87931,0.6995,0,37.0,44.0
335819,PARK AVENUE EXTENDED CARE FACILITY,LONG BEACH,Nassau,NY,2.0,5.0,2.65457,0.9408333333333334,0,46.0,56.0
335160,LYNBROOK RESTORATIVE THERAPY AND NURSING,LYNBROOK,Nassau,NY,5.0,5.0,3.06258,0.875,0,9.0,12.0
335702,NORTHWELL HEALTH STERN FAMILY CENTER FOR REHAB,MANHASSET,Nassau,NY,3.0,5.0,4.37103,0.9390625,0,28.0,32.0
335074,"PARKVIEW CARE AND REHABILITATION CENTER, INC",MASSAPEQUA,Nassau,NY,4.0,2.0,2.76175,0.9201183431952663,0,20.0,20.0
335871,MOUNT SINAI SOUTH NASSAU T C U,OCEANSIDE,Nassau,NY,5.0,4.0,4.91269,0.8800000000000001,0,2.0,0.0
335158,OCEANSIDE CARE CENTER INC,OCEANSIDE,Nassau,NY,4.0,4.0,3.14849,0.991,0,22.0,16.0
335284,CENTRAL ISLAND HEALTHCARE,PLAINVIEW,Nassau,NY,3.0,5.0,2.97223,0.7658415841584157,0,31.0,32.0
335022,SANDS POINT CENTER FOR HEALTH AND REHABILITATION,PORT WASHINGTON,Nassau,NY,3.0,4.0,2.2133,0.7872222222222222,0,26.0,28.0
335747,"ROCKVILLE SKILLED NURSING & REHAB CENTER, L L C",ROCKVILLE CENTRE,Nassau,NY,4.0,5.0,2.87791,0.9424242424242425,0,15.0,16.0
335297,THE GRAND PAVILION FOR RHB & NRSG AT ROCKVILLE CTR,ROCKVILLE CENTRE,Nassau,NY,2.0,4.0,2.60842,0.9727848101265822,0,53.0,56.0
335559,SUNHARBOR MANOR,ROSLYN HEIGHTS,Nassau,NY,2.0,4.0,3.26098,0.9263157894736842,0,39.0,40.0
335023,A Holly Patterson Extended Care Facility,UNIONDALE,Nassau,NY,1.0,3.0,3.18885,0.7327674023769101,1,242.25,297.0
335798,TOWNHOUSE CENTER FOR REHABILITATION & NURSING,UNIONDALE,Nassau,NY,4.0,2.0,2.63972,0.9321428571428572,0,24.0,24.0
335700,NORTH SHORE - L I J ORZAC CTR FOR REHABILITATION,VALLEY STREAM,Nassau,NY,2.0,4.0,4.92626,0.9325,0,42.75,24.0
335231,"EXCEL AT WOODBURY FOR REHAB AND NURSING, L L C",WOODBURY,Nassau,NY,5.0,5.0,3.36226,0.8048780487804879,0,9.0,8.0
335690,WHITE OAKS REHABILITATION AND NURSING CENTER,WOODBURY,Nassau,NY,3.0,3.0,3.58398,0.887,0,35.0,32.0
335555,WOODBURY HEIGHTS NURSING AND REHABILITATION CENTER,WOODBURY,Nassau,NY,1.0,4.0,4.35052,0.35544554455445543,0,127.5,68.0
335718,THE FIVE TOWNS PREMIER REHAB & NURSING CENTER,WOODMERE,Nassau,NY,3.0,5.0,2.647,0.8023809523809524,0,38.0,40.0
335802,Glen Arden Inc,GOSHEN,New York,NY,1.0,4.0,5.26811,0.8400000000000001,0,83.0,108.0
335092,HENRY J CARTER SKILLED NURSING FACILITY,MANHATTAN,New York,NY,3.0,2.0,3.53966,0.9304878048780487,0,26.0,24.0
335570,AMSTERDAM NURSING HOME CORP (1992),NEW YORK,New York,NY,4.0,5.0,3.04737,0.9821515892420538,0,21.0,28.0
335257,FORT TRYON CENTER FOR REHABILITATION AND NURSING,NEW YORK,New York,NY,5.0,2.0,3.35088,0.9824390243902439,0,11.0,12.0
335522,"HARLEM CTR FOR NURSING AND REHABILITATION, L L C",NEW YORK,New York,NY,2.0,3.0,3.0708,0.9795,0,69.0,76.0
335100,ISABELLA GERIATRIC CENTER INC,NEW YORK,New York,NY,2.0,2.0,3.14462,0.9785815602836879,0,60.0,60.0
335050,MARY MANNING WALSH NURSING HOME CO INC,NEW YORK,New York,NY,4.0,5.0,3.18536,0.9469613259668509,0,18.0,20.0
335517,NEW EAST SIDE NURSING HOME,NEW YORK,New York,NY,5.0,3.0,3.3108,0.9396551724137931,0,6.0,0.0
335461,NEW GOUVERNEUR HOSPITAL S N F,NEW YORK,New York,NY,4.0,5.0,5.01635,0.9715254237288137,0,15.0,12.0
335792,NORTHERN MANHATTAN REHABILITATION AND NURSING CTR,NEW YORK,New York,NY,1.0,2.0,2.62816,0.9528125,1,80.0,80.0
335762,ST MARYS CENTER INC,NEW YORK,New York,NY,4.0,,5.04609,0.9179487179487179,0,12.0,12.0
335665,TERENCE CARDINAL COOKE HEALTH CARE CENTER,NEW YORK,New York,NY,3.0,4.0,3.44018,0.7823269513991165,0,26.0,24.0
335491,"THE NEW JEWISH HOME, MANHATTAN",NEW YORK,New York,NY,2.0,5.0,3.44503,0.7937743190661478,0,60.75,24.0
335334,THE RIVERSIDE,NEW YORK,New York,NY,4.0,5.0,2.4492,0.9492307692307693,0,25.0,12.0
335027,WEST VILLAGE REHABILITATION AND NURSING CENTER,NEW YORK,New York,NY,4.0,5.0,3.03023,0.9542857142857143,0,16.0,20.0
335232,UPPER EAST SIDE REHABILITATION AND NURSING CENTER,NEW YORK CITY,New York,NY,4.0,5.0,2.74732,0.9098196392785571,0,16.0,16.0
335063,COLER REHABILITATION AND NURSING CARE CENTER,ROOSEVELT ISLAND,New York,NY,4.0,3.0,5.03055,0.6092024539877301,0,16.0,4.0
335824,PUTNAM RIDGE,BREWSTER,Putnam,NY,1.0,3.0,3.37272,0.91375,0,124.0,144.0
335229,PUTNAM NURSING & REHABILITATION CENTER,HOLMES,Putnam,NY,2.0,2.0,2.92007,0.665625,1,66.0,84.0
335415,"LAWRENCE NURSING CARE CENTER, INC",ARVERNE,Queens,NY,1.0,3.0,2.1943,0.9915,0,109.0,128.0
335738,OCEAN GARDENS CARE CENTER,ARVERNE,Queens,NY,2.0,3.0,2.75716,0.9396428571428572,0,64.0,56.0
335199,RESORT NURSING HOME,ARVERNE,Queens,NY,4.0,3.0,3.67203,0.77,0,17.0,12.0
335838,NEW YORK CENTER FOR REHABILITATION & NURSING,ASTORIA,Queens,NY,4.0,4.0,3.50584,0.9621428571428571,0,12.0,16.0
335363,OZANAM HALL OF QUEENS NURSING HOME INC,BAYSIDE,Queens,NY,3.0,4.0,3.70705,0.8601851851851853,0,25.0,24.0
33A081,ST MARYS HOSPITAL FOR CHILDREN,BAYSIDE,Queens,NY,5.0,,,1.0024193548387097,0,9.0,4.0
335317,PARK TERRACE CARE CENTER,CORONA,Queens,NY,2.0,4.0,,0.9640000000000001,0,63.0,52.0
335814,ELMHURST CARE CENTER INC,EAST ELMHURST,Queens,NY,4.0,5.0,3.38561,0.9670833333333333,0,22.0,16.0
335682,BEACH GARDENS REHAB AND NURSING CENTER,FAR ROCKAWAY,Queens,NY,3.0,1.0,3.39307,0.9558282208588957,0,34.0,44.0
335666,BEZALEL REHABILITATION AND NURSING CENTER,FAR ROCKAWAY,Queens,NY,4.0,3.0,3.11568,0.9525,0,19.0,0.0
335582,BROOKHAVEN REHAB & HEALTH CARE CENTER L L C,FAR ROCKAWAY,Queens,NY,2.0,1.0,3.12009,0.9684563758389263,0,61.0,64.0
335044,FAR ROCKAWAY CENTER FOR REHABILITATION AND NURSING,FAR ROCKAWAY,Queens,NY,2.0,1.0,2.93146,0.972,0,49.0,56.0
335676,"HAVEN MANOR HEALTH CARE CENTER, L L C",FAR ROCKAWAY,Queens,NY,2.0,,1.86239,0.9033333333333334,0,45.0,44.0
335168,OCEANVIEW NURSING & REHABILITATION CARE CENTER,FAR ROCKAWAY,Queens,NY,2.0,4.0,2.46133,0.9568627450980391,0,45.0,40.0
335387,PENINSULA NURSING AND REHABILITATION CENTER,FAR ROCKAWAY,Queens,NY,1.0,4.0,2.74497,0.915,0,92.25,119.0
335165,PREMIER NSG & REHAB CENTER OF FAR ROCKAWAY,FAR ROCKAWAY,Queens,NY,3.0,3.0,2.59582,0.9540983606557377,0,32.0,28.0
335448,QUEENS NASSAU REHABILITATION AND NURSING CENTER,FAR ROCKAWAY,Queens,NY,2.0,2.0,3.38475,0.9745,0,45.75,24.0
335571,ROCKAWAY CARE CENTER,FAR ROCKAWAY,Queens,NY,1.0,1.0,2.95911,0.9035087719298246,0,112.25,143.0
335737,"WEST LAWRENCE CARE CENTER, L L C",FAR ROCKAWAY,Queens,NY,1.0,4.0,2.34458,0.7423255813953488,0,77.0,80.0
335349,CLIFFSIDE REHAB & RESIDENTIAL HEALTH CARE CENTER,FLUSHING,Queens,NY,4.0,3.0,3.53593,0.9197247706422018,0,19.0,20.0
335446,CYPRESS GARDEN CENTER FOR NURSING AND REHAB,FLUSHING,Queens,NY,4.0,5.0,2.53417,0.9762589928057553,0,23.0,28.0
335426,FRANKLIN CENTER FOR REHABILITATION AND NURSING,FLUSHING,Queens,NY,4.0,3.0,3.25496,0.974375,0,21.0,24.0
335294,LONG ISLAND CARE CENTER INC,FLUSHING,Queens,NY,4.0,5.0,3.00049,0.9540000000000001,0,25.0,20.0
335143,MEADOW PARK REHABILITATION AND HEALTH CENTER L L C,FLUSHING,Queens,NY,3.0,4.0,2.61594,0.9503703703703704,0,27.0,36.0
335379,REGO PARK NURSING HOME,FLUSHING,Queens,NY,3.0,3.0,2.41457,0.943,0,28.0,28.0
335133,SAPPHIRE CENTER FOR REHAB & NURSING,FLUSHING,Queens,NY,1.0,5.0,3.1025,0.9484581497797357,0,90.25,8.0
335804,THE PAVILION AT QUEENS FOR REHABILITATION & NRSING,FLUSHING,Queens,NY,2.0,5.0,2.68492,0.9562913907284769,0,59.0,68.0
335799,UNION PLAZA CARE CENTER,FLUSHING,Queens,NY,4.0,4.0,2.84309,0.9507142857142856,0,13.0,16.0
335154,WATERVIEW NURSING CARE CENTER,FLUSHING,Queens,NY,2.0,1.0,2.11094,0.884,0,57.0,60.0
335266,"WOODCREST REHAB & RESIDENTIAL H C CENTER, L L C",FLUSHING,Queens,NY,3.0,2.0,3.35837,0.9715,0,34.0,32.0
335146,FAIRVIEW NURSING CARE CENTER INC,FOREST HILLS,Queens,NY,3.0,5.0,3.3927,0.9854999999999999,0,36.0,32.0
335139,FOREST HILLS CARE CENTER,FOREST HILLS,Queens,NY,3.0,5.0,3.2674,0.884,0,26.0,20.0
335310,FOREST VIEW CENTER FOR REHABILITATION & NURSING,FOREST HILLS,Queens,NY,5.0,5.0,3.5702,0.9893750000000001,0,7.0,4.0
335299,"NEW GLEN OAKS NURSING HOME, INC",GLEN OAKS,Queens,NY,3.0,4.0,3.54788,0.9333333333333333,0,29.0,32.0
335333,HOLLIS PARK MANOR NURSING HOME,HOLLIS,Queens,NY,5.0,5.0,3.92634,0.95625,0,8.0,4.0
335503,HOLLISWOOD CTR FOR REHABILITATION AND HEALTHCARE,HOLLIS,Queens,NY,2.0,3.0,3.8475,0.9566878980891719,0,61.25,24.0
335820,REGAL HEIGHTS REHABILITATION AND HEALTH CARE CTR,JACKSON HEIGHTS,Queens,NY,3.0,5.0,3.19304,0.975,0,38.0,40.0
335631,CHAPIN HOME FOR THE AGING,JAMAICA,Queens,NY,5.0,5.0,3.91511,0.6195454545454546,0,7.0,8.0
335505,HIGHLAND CARE CENTER,JAMAICA,Queens,NY,4.0,3.0,2.90757,0.9596875,0,22.0,16.0
335856,JAMAICA HOSPITAL MEDICAL CENTER T C U,JAMAICA,Queens,NY,5.0,,,,0,0.0,0.0
335436,JAMAICA HOSPITAL NURSING HOME CO INC,JAMAICA,Queens,NY,4.0,5.0,3.60088,0.9712389380530974,0,13.0,0.0
335336,MARGARET TIETZ CENTER FOR NURSING CARE INC,JAMAICA,Queens,NY,5.0,5.0,2.59006,0.9590000000000001,0,6.0,0.0
335770,N Y S VETERANS HOME IN N Y C,JAMAICA,Queens,NY,4.0,4.0,4.86194,0.8696,0,22.0,20.0
335724,SILVERCREST,JAMAICA,Queens,NY,2.0,3.0,2.76658,0.938125,0,55.0,60.0
335531,HILLSIDE MANOR REHAB & EXTENDED CARE CENTER,JAMAICA EST,Queens,NY,2.0,4.0,3.39639,0.9159999999999999,0,61.5,24.0
335434,LITTLE NECK CARE CENTER,LITTLE NECK,Queens,NY,3.0,5.0,3.23009,0.9358333333333333,0,28.0,24.0
335472,CENTRAL QUEENS REHAB & NURSING CENTER,MASPETH,Queens,NY,3.0,3.0,3.04714,0.981,0,41.0,28.0
335416,DRY HARBOR NURSING HOME,MIDDLE VILLAGE,Queens,NY,4.0,5.0,3.60545,0.9524999999999999,0,18.0,16.0
335132,PARKER JEWISH INSTITUTE FOR HEALTH CARE & REHAB,NEW HYDE PARK,Queens,NY,5.0,5.0,3.30873,0.9301707779886148,0,8.0,4.0
335606,QUEEN OF PEACE RESIDENCE,QUEENS VILLAGE,Queens,NY,4.0,,8.03202,0.5622641509433962,0,18.0,20.0
335155,WINDSOR PARK REHAB & NURSING CENTER,QUEENS VILLAGE,Queens,NY,1.0,1.0,4.12509,0.8957142857142858,0,170.0,12.0
335726,BEACON REHABILITATION AND NURSING CENTER,ROCKAWAY PARK,Queens,NY,3.0,5.0,3.20344,0.9433333333333334,0,31.0,24.0
335093,PARK NURSING HOME,ROCKAWAY PARK,Queens,NY,3.0,2.0,3.34851,0.976530612244898,0,33.0,20.0
335292,PROMENADE REHABILITATION AND HEALTH CARE CENTER,ROCKAWAY PARK,Queens,NY,3.0,2.0,2.7279,0.895,0,36.0,40.0
335327,BRIDGE VIEW NURSING HOME,WHITESTONE,Queens,NY,3.0,4.0,2.68938,0.988,0,25.0,32.0
335130,THE GRAND REHABILITATION AND NURSING AT QUEENS,WHITESTONE,Queens,NY,4.0,4.0,2.77326,0.9798882681564246,0,15.0,16.0
335791,QUEENS BOULEVARD EXTENDED CARE FACILITY,WOODSIDE,Queens,NY,4.0,5.0,2.77964,0.9235714285714286,0,20.0,16.0
335455,CARMEL RICHMOND HEALTHCARE AND REHAB CENTER,STATEN ISLAND,Richmond,NY,4.0,5.0,2.79146,0.9026666666666667,0,13.0,16.0
335239,"CLOVE LAKES HEALTH CARE AND REHAB CENTER, INC",STATEN ISLAND,Richmond,NY,3.0,5.0,2.88792,0.8201388888888889,0,33.0,20.0
335332,EGER HEALTH CARE AND REHABILITATION CENTER,STATEN ISLAND,Richmond,NY,2.0,5.0,2.9021,0.7828042328042327,0,43.0,32.0
335502,GOLDEN GATE REHABILITATION & HEALTH CARE CENTER,STATEN ISLAND,Richmond,NY,1.0,4.0,2.55347,0.965546218487395,0,105.25,24.0
335372,"NEW VANDERBILT REHABILITATION AND CARE CENTER, INC",STATEN ISLAND,Richmond,NY,1.0,,3.04518,0.8115625,0,88.0,84.0
335772,RICHMOND CTR FOR REHAB AND SPECIALTY HEALTHCARE,STATEN ISLAND,Richmond,NY,2.0,4.0,4.95069,0.957258064516129,0,69.0,76.0
335108,SEA VIEW HOSPITAL REHABILITATION CENTER AND HOME,STATEN ISLAND,Richmond,NY,4.0,5.0,4.57514,0.9845394736842106,0,17.0,20.0
335196,SILVER LAKE SPECIALIZED REHAB AND CARE CENTER,STATEN ISLAND,Richmond,NY,3.0,1.0,2.95106,0.6712230215827338,0,34.0,44.0
335561,STATEN ISLAND CARE CENTER,STATEN ISLAND,Richmond,NY,4.0,5.0,2.37104,0.9576666666666667,0,21.0,20.0
335273,VERRAZANO NURSING AND POST-ACUTE CENTER,STATEN ISLAND,Richmond,NY,3.0,4.0,3.1983,0.9358333333333333,0,40.0,24.0
335418,"NORTHERN RIVERVIEW HEALTH CARE, INC",HAVERSTRAW,Rockland,NY,1.0,3.0,2.72369,0.9846153846153846,0,118.0,144.0
335380,NORTHERN METROPOLITAN RES HEALTH CARE FACILITY INC,MONSEY,Rockland,NY,2.0,3.0,2.9157,0.9791666666666666,0,39.0,52.0
335046,NORTHERN MANOR GERIATRIC CENTER INC,NANUET,Rockland,NY,1.0,1.0,2.79625,0.9709956709956711,0,75.0,56.0
335734,"FRIEDWALD CENTER FOR REHAB AND NURSING, L L C",NEW CITY,Rockland,NY,2.0,5.0,3.3451,0.9544444444444445,0,54.0,64.0
335285,PINE VALLEY CENTER FOR REHABILITATION AND NURSING,SPRING VALLEY,Rockland,NY,2.0,2.0,4.18103,0.975625,0,54.0,56.0
335148,THE WILLOWS AT RAMAPO REHAB AND NURSING CENTER,SUFFERN,Rockland,NY,2.0,5.0,2.83915,0.932512315270936,0,53.0,60.0
335365,NYACK RIDGE REHABILITATION AND NURSING CENTER,VALLEY COTTAGE,Rockland,NY,1.0,2.0,3.22513,0.931875,0,129.75,116.0
335311,TOLSTOY FOUNDATION REHABILITATION AND NRSG CENTER,VALLEY COTTAGE,Rockland,NY,1.0,3.0,3.68602,0.5906250000000001,1,359.75,453.0
335823,HELEN HAYES HOSPITAL R H C F,WEST HAVERSTRAW,Rockland,NY,5.0,5.0,6.74869,0.96,0,3.0,4.0
335873,HELEN HAYES HOSPITAL T C U,WEST HAVERSTRAW,Rockland,NY,5.0,5.0,6.98336,0.8958333333333334,0,0.0,0.0
335213,MASSAPEQUA CENTER REHABILITATION & NURSING,AMITYVILLE,Suffolk,NY,4.0,5.0,2.9614,0.91375,0,12.0,16.0
335568,SUNRISE MANOR CTR FOR NURSING AND REHABILITATION,BAY SHORE,Suffolk,NY,3.0,3.0,,,0,40.75,20.0
335837,MARIA REGINA REHABILITATION AND NURSING,BRENTWOOD,Suffolk,NY,3.0,5.0,3.77964,0.9297872340425533,0,36.0,32.0
335159,ROSS CENTER FOR NURSING AND REHABILITATION,BRENTWOOD,Suffolk,NY,2.0,5.0,3.06125,0.7807407407407407,0,54.0,60.0
335755,BELLHAVEN CENTER FOR REHAB AND NURSING CARE,BROOKHAVEN,Suffolk,NY,1.0,5.0,2.49913,0.9825,0,120.75,149.0
335402,"OASIS REHABILITATION AND NURSING, LLC",CENTER MORICHES,Suffolk,NY,5.0,5.0,2.89749,0.95,0,6.0,4.0
335696,GURWIN JEWISH NURSING AND REHABILITATION CENTER,COMMACK,Suffolk,NY,3.0,5.0,3.17497,0.9108695652173913,0,36.0,28.0
335401,MOMENTUM AT SOUTH BAY FOR REHAB AND NURSING,EAST ISLIP,Suffolk,NY,4.0,5.0,3.16274,0.875,0,17.0,20.0
335694,BROOKHAVEN HEALTH CARE FACILITY L L C,EAST PATCHOGUE,Suffolk,NY,3.0,4.0,3.89927,0.93875,0,24.0,20.0
335842,PECONIC LANDING AT SOUTHOLD,GREENPORT,Suffolk,NY,4.0,5.0,5.38883,0.7924242424242424,0,13.0,12.0
335274,SAN SIMEON BY THE SOUND CENTER FOR NURSING & REHAB,GREENPORT,Suffolk,NY,1.0,3.0,3.38481,0.9608333333333333,0,209.75,215.0
335835,ISLAND NURSING AND REHAB CENTER,HOLTSVILLE,Suffolk,NY,4.0,4.0,3.43658,0.8716666666666666,0,19.0,16.0
335286,CARILLON NURSING AND REHABILITATION CENTER,HUNTINGTON,Suffolk,NY,3.0,5.0,2.75128,0.9050793650793652,0,30.0,28.0
